Кровать,Стильная молодежная кровать,FURNITURE,,2025-01-01
Смартфон Pro X,Флагманский смартфон с тройной камерой,,999.49,2025-01-01
Ноутбук UltraBook,Мощный ноутбук для работы и игр,ELECTRONICS,1499.75,
Беспроводные наушники Air Sound,Кристально чистый звук без проводов,,,
Умные часы Style Watch,Стильный аксессуар с фитнес-трекером,ACCESSORIES,249.90,2025-01-01,
Кожаный рюкзак Urban Pack,Вместительный рюкзак для города,ACCESSORIES,
Диван-кровать Комфорт,Удобный диван с механизмом трансформации,FURNITURE,599.25,2025-01-01
Обеденный стол Лофт,Стол из массива дуба в индустриальном стиле,FURNITURE,349.80,2025-01-01
Кресло Релакс,Мягкое кресло для отдыха и чтения,FURNITURE,219.99,2025-01-01
Тестровая запись
,,,,,
,,,
,,,346.534,ывпа
,,rtyhretdh,324,
Солнцезащитные очки Aviator,Классическая модель с поляризацией линз,ACCESSORIES,59.95,2025-01-01
Игровая консоль NextGen,Консоль нового поколения с поддержкой 4K,ELECTRONICS,499.45,2025-01-01
Планшет Tab 10,Планшет с ярким 10-дюймовым экраном,ELECTRONICS,329.40,2025-01-01
Кровать Афина,Двуспальная кровать с мягким изголовьем,FURNITURE,450.65,2025-01-01
Шкаф-купе Гармония,Вместительный шкаф для вашей спальни,FURNITURE,750.85,2025-01-01
Кошелек из натуральной кожи,Элегантный и практичный бумажник,ACCESSORIES,44.90,2025-01-01
Ремень классический,Кожаный ремень для мужских брюк,ACCESSORIES,29.99,2025-01-01
Телевизор 4K Smart TV,55-дюймовый телевизор с функцией Smart TV,ELECTRONICS,899.20,2025-01-01
Кофейный столик Модерн,Стильный столик для гостиной комнаты,FURNITURE,120.55,2025-01-01
Стул Вена,Эргономичный стул для кухни или столовой,FURNITURE,74.99,2025-01-01
Шарф кашемировый,Теплый и мягкий шарф из кашемира,ACCESSORIES,65.30,2025-01-01
Роутер Wi-Fi 6,Высокоскоростной роутер для стабильного интернета,ELECTRONICS,109.95,2025-01-01
Комод с 4 ящиками,Практичный комод для хранения вещей,FURNITURE,279.60,2025-01-01
Bluetooth-колонка Wave,Портативная колонка с объемным звуком,ELECTRONICS,79.99,2025-01-01
Кепка бейсбольная,Модная кепка с фирменным логотипом,ACCESSORIES,19.85,2025-01-01
Фотоаппарат Mirrorless Pro,Профессиональная беззеркальная камера,ELECTRONICS,1890.50,2025-01-01
Стеллаж Куб,Современный стеллаж для книг и декора,FURNITURE,149.90,2025-01-01
Зонт-трость Автомат,Надежный зонт с автоматическим механизмом,ACCESSORIES,35.75,2025-01-01
Прикроватная тумба Ночь,Компактная тумба для спальни,FURNITURE,89.95,2025-01-01
Чехол для смартфона Silicone,Противоударный силиконовый чехол,ACCESSORIES,15.99,2025-01-01
Электронная книга Reader,Устройство для чтения с подсветкой экрана,ELECTRONICS,129.80,2025-01-01
Пуф Оттоманка,Мягкий пуф для ног или как сиденье,FURNITURE,59.90,2025-01-01
Серебряный браслет Цепь,Стильный браслет из серебра 925 пробы,ACCESSORIES,115.45,2025-01-01
Внешний аккумулятор PowerBank,Емкий аккумулятор на 20000 мАч,ELECTRONICS,49.95,2025-01-01
Офисное кресло Ergo,Эргономичное кресло для долгой работы,FURNITURE,309.70,2025-01-01
Веб-камера Full HD,Камера для видеоконференций высокого разрешения,ELECTRONICS,69.25,2025-01-01
Настенные часы Минимализм,Лаконичные часы для современного интерьера,ACCESSORIES,39.99,2025-01-01
Компьютерная мышь Gaming,Игровая мышь с настраиваемой подсветкой,ELECTRONICS,55.49,2025-01-01
Письменный стол Студент,Функциональный стол для учебы и работы,FURNITURE,179.95,2025-01-01
Клавиатура механическая RGB,Механическая клавиатура для геймеров,ELECTRONICS,125.80,2025-01-01
Набор полотенец Отель,Комплект из трех мягких банных полотенец,ACCESSORIES,39.95,2025-01-01
Торшер Сфера,Напольный светильник с мягким светом,FURNITURE,94.90,2025-01-01
Микроволновая печь Grill,Печь с функцией гриля и конвекции,ELECTRONICS,149.75,2025-01-01
Книжная полка Соты,Оригинальная настенная полка для книг,FURNITURE,85.20,2025-01-01
Умная розетка Wi-Fi,Управляйте приборами со смартфона,ELECTRONICS,24.99,2025-01-01
Сумка-шоппер Эко,Вместительная тканевая сумка для покупок,ACCESSORIES,21.95,2025-01-01
Барный стул Хром,Высокий стул для домашней барной стойки,FURNITURE,109.50,2025-01-01
Фитнес-браслет Pulse,Отслеживание активности и пульса 24/7,ELECTRONICS,39.90,2025-01-01
Зеркало в полный рост Ампир,Напольное зеркало в красивой резной раме,FURNITURE,189.99,2025-01-01
Портмоне мужское,Классическое портмоне для карт и наличных,ACCESSORIES,49.80,2025-01-01
Проектор Home Cinema,Компактный проектор для домашнего кинотеатра,ELECTRONICS,449.60,2025-01-01
Вешалка напольная Стиль,Металлическая вешалка для верхней одежды,FURNITURE,69.95,2025-01-01
USB-хаб 7 портов,Расширитель портов стандарта USB 3.0,ELECTRONICS,29.90,2025-01-01
Галстук шелковый,Элегантный галстук из натурального шелка,ACCESSORIES,48.25,2025-01-01
Полка для обуви Комфорт,Трехъярусная полка для вашей прихожей,FURNITURE,54.99,2025-01-01
Экшн-камера 4K Extreme,Камера для съемки в экстремальных условиях,ELECTRONICS,219.90,2025-01-01
Набор бокалов для вина,Комплект из 6 хрустальных винных бокалов,ACCESSORIES,59.85,2025-01-01
Картина на холсте Абстракция,Современное искусство для вашего интерьера,ACCESSORIES,129.50,2025-01-01
Электрический чайник Steel,Чайник из нержавеющей стали с подсветкой,ELECTRONICS,44.95,2025-01-01
Журнальный столик Стекло,Столик со стеклянной ударопрочной столешницей,FURNITURE,139.70,2025-01-01
Монитор 27 дюймов IPS,Монитор с качественной цветопередачей,ELECTRONICS,349.99,2025-01-01
Подставка для ноутбука,Эргономичная подставка с активным охлаждением,ACCESSORIES,32.80,2025-01-01
Стул офисный Менеджер,Удобный стул для руководителя с подлокотниками,FURNITURE,249.95,2025-01-01
Видеорегистратор Drive,Запись ваших поездок в качестве Full HD,ELECTRONICS,98.90,2025-01-01
Наручные часы Классика,Кварцевые часы в стальном водонепроницаемом корпусе,ACCESSORIES,179.55,2025-01-01
Тумба под ТВ Глянец,Современная тумба для большого телевизора,FURNITURE,209.90,2025-01-01
Саундбар 2.1 Sound,Аудиосистема для ТВ с беспроводным сабвуфером,ELECTRONICS,199.49,2025-01-01
Запонки Престиж,Стильные запонки для мужской рубашки,ACCESSORIES,74.95,2025-01-01
Матрас ортопедический Сон,Матрас 160х200 с независимыми пружинами,FURNITURE,379.80,2025-01-01
Графический планшет Artist,Планшет для цифрового рисования и ретуши,ELECTRONICS,279.99,2025-01-01
Термос Арктика,Сохраняет температуру напитка до 24 часов,ACCESSORIES,41.50,2025-01-01
Кухонный комбайн Мастер,Многофункциональный помощник на вашей кухне,ELECTRONICS,249.65,2025-01-01
Скамья для прихожей Уют,Скамья с мягким сиденьем и полкой для обуви,FURNITURE,134.90,2025-01-01
GPS-навигатор Way,Автомобильный навигатор с обновляемыми картами,ELECTRONICS,114.99,2025-01-01
Дорожная сумка Вояж,Вместительная сумка для дальних путешествий,ACCESSORIES,94.75,2025-01-01
Детская кровать Сказка,Кровать-машинка для вашего ребенка,FURNITURE,319.50,2025-01-01
MP3-плеер Music Go,Компактный музыкальный плеер с клипсой,ELECTRONICS,59.95,2025-01-01
Коврик для мыши XXL,Большой игровой коврик для мыши и клавиатуры,ACCESSORIES,27.90,2025-01-01
Шезлонг Пляж,Складной шезлонг для отдыха на природе,FURNITURE,79.99,2025-01-01
Принтер МФУ,Устройство 3-в-1 принтер сканер и копир,ELECTRONICS,169.45,2025-01-01
Декоративная подушка Вельвет,Мягкая подушка для дивана или кресла,ACCESSORIES,24.90,2025-01-01
Сервант Винтаж,Классический сервант для хранения посуды,FURNITURE,549.25,2025-01-01
Умная колонка Голос,Голосовой помощник для умного дома,ELECTRONICS,89.90,2025-01-01
Брелок для ключей Талисман,Оригинальный брелок из металла и кожи,ACCESSORIES,18.49,2025-01-01
Складной стул Пикник,Легкий стул для выезда на природу,FURNITURE,34.95,2025-01-01
Дрон с камерой Fly Cam,Квадрокоптер для качественной аэросъемки,ELECTRONICS,399.00,2025-01-01
Фоторамка цифровая,Показывает ваши фото в режиме слайд-шоу,ELECTRONICS,74.80,2025-01-01
Подсвечник Кристалл,Элегантный подсвечник на 3 свечи,ACCESSORIES,45.50,2025-01-01
Гамак Лето,Подвесной гамак для дачи или сада,FURNITURE,64.99,2025-01-01
Радионяня Baby Monitor,Надежный контроль за сном вашего ребенка,ELECTRONICS,89.70,2025-01-01
Шкатулка для украшений,Деревянная шкатулка с несколькими отделениями,ACCESSORIES,57.95,2025-01-01
Компьютерный стол Геймер,Стол с эргономичным вырезом для игрока,FURNITURE,289.60,2025-01-01
SSD-накопитель 1TB,Скоростной твердотельный диск для ПК,ELECTRONICS,119.99,2025-01-01
Виниловый проигрыватель Retro,Проигрыватель в ретро-стиле с Bluetooth,ELECTRONICS,209.50,2025-01-01
Настольная лампа LED,Лампа с регулировкой яркости и цветовой температуры,FURNITURE,49.90,2025-01-01
Чехол для ноутбука 15,Защитный чехол для 15-дюймового ноутбука,ACCESSORIES,31.95,2025-01-01
Электросамокат City Ride,Быстрый и удобный транспорт для города,ELECTRONICS,479.99,2025-01-01
Кресло-качалка Уют,Классическое кресло-качалка из натурального ротанга,FURNITURE,239.40,2025-01-01
Мультитул Мастер,Многофункциональный инструмент 12 в 1 из стали,ACCESSORIES,49.99,2025-01-01
Увлажнитель воздуха Aqua,Поддерживает оптимальную влажность в комнате,ELECTRONICS,64.52,2025-01-01
name,surname,ACCESSORIES,4364356453.7568767,2025-11-12
newItem,new item desc numero 103,FURNITURE,64357,2025-11-13
final product,final product for test,ELECTRONICS,6745,2025-11-13
546fgrh,rtedhert65h etrh etryhetr h,FURNITURE,1245,2025-11-13